{"version":1,"run_configuration":"sha256=a55e3662f9d87b8f88476024bae95cd695e673ff82219aa009857950c2e68de3","credentials":["forge","model"],"values":[{"credential":"forge","value":"fixture-forge-token-not-a-real-one"},{"credential":"model","value":"fixture-model-key-not-a-real-one"},{"credential":"search","value":"fixture-search-key-not-a-real-one"}]}